id,title,selftext,author,created_utc,created_date,score,num_comments,url,subreddit,search_query
56vmk9,"Samsung officially recalls ALL Note 7 phones, including replacements from the original recall.",,Ramgolf12,1476149186.0,2016-10-11 09:26:26,23,15,http://www.samsung.com/us/note7recall/,samsung,Note 7 recall
5hrjxt,"I know buying and selling is frowned upon, but maybe you guys can help. I want to find a Note 7. New preferred but used is okay. READ!","I know, I know, recall, safety hazard, blah blah blah. I want one for collector's value. It will not ever be powered on, it will sit in the box in a hard protective case in a safe for several years until it's extremely collectible and sought after. That said, IF YOU HAVE ONE, I WANT IT. NAME YOUR PRICE! I WILL PAY UP! Any carrier, any storage, and I don't care if it's the original N7 or the replacement S version. 

I'd be willing to offer AT LEAST $900-1000 to anyone who has one, and if it's new in box sealed, I'd be willing to start around $1200-1300 or even more. I also have some other rare collectible electronics I could trade you. In contract? I'll buy out your contract for you as well so you don't have to trade it in! Over 93% of these devices have been returned so I NEED ONE ASAP!!! Please help, or even help link me with someone who has one! 

In addition, if you can link me to someone who has a Note 7, AND it results in a completed sale, I am willing to offer $100.00 as a finder's fee!

Please, I am NOT kidding around here! I am COMPLETELY SERIOUS! I will pay through PayPal, and have it shipped FedEx with full insurance and signature, hell, if you're in the continental USA, I'll fly to you to pick it up and pay in cash! ",JDB3326,1481481521.0,2016-12-12 02:38:41,3,16,https://www.reddit.com/r/samsung/comments/5hrjxt/i_know_buying_and_selling_is_frowned_upon_but/,samsung,Note 7 recall
521mg3,Who here is still holding on to their Note 7's despite the recall? What precautions are you taking?,"As the title says. I for one can't be arsed to swap my Note 7 to something else, only to swap it back to a Note 7 later. It took me forever to transfer and set everything up this time round. Plus, for AT&T at least, it seems they're only giving you the new phone once you send your current one in, which kinda doesn't give me a lot of options for backing up and transferring my data. So I'm waiting for the fixed Note 7s to come out again, before I do my swap.

I for one have disabled fast charge, kept my phone out of the sun/heat, and only either used OEM chargers or Qi wireless charging. Basically, try to keep the amount of juice you're pumping into the battery minimal - enough for a charge, but not so fast it causes overheating. I also theorized that some of the explosions could've been caused partly by third-party USB-C chargers (the cheapo Chinese ones) that aren't certified (look up the Google guy whose Macbook got fried because of a cheap USB-C charger and started certifying them from now on).

From my limited understanding of batteries in engineering school and from the reports about hot Note 7s before they explode, I'm also minimizing the amount of heat it generates - every time my phone starts to feel warm, I stop charging and cool it under cold water immediately. I also stopped using it while it's charging.",Vorsipellis,1473483078.0,2016-09-10 12:51:18,3,11,https://www.reddit.com/r/samsung/comments/521mg3/who_here_is_still_holding_on_to_their_note_7s/,samsung,Note 7 recall
578ad6,[news] Samsung's Galaxy Note 7 Recall Is an Environmental Travesty,,rxo6110,1476329321.0,2016-10-13 11:28:41,12,10,http://motherboard.vice.com/read/galaxy-note-7-explosion-environmental-impact-recycling?utm_source=vicenewsfb,samsung,Note 7 recall
5b9232,Getting really frustrated with the Note 7 exchange in Australia.,"I am seriously getting frustrated with the Note 7 exchange program here.    
  
I bought a Note 7 from a store in Singapore, was force to leave it behind and had a family member ship the replacement Note 7 to me. And now the saga really begins.  
  
So the 2nd Note 7 recall begins, I go to a Samsung store in Australia, they tell me I have to go through support.  
I call support on October 13 and they say 14-21 buisiness days for processing and I get a replacement Edge 7.    
OK, that's fair organizing this stuff takes time, etc.  
Now, I get a call on Nov 3rd, ""Oh your processing is complete, now wait up to 21 business days  for us to send a courier to your door, no we aren't going to make sure he calls you to arrange some pickup time, it's down to pure luck if you're around at that time, he might leave you a note if he can't find you. "" Well duh, we haven't coordinated jack! Are they just expecting me to be at my apartment for the entirety of the next 21 days?  
  
Oh and they'll be sending me the gift voucher by SNAIL MAIL, and they are only posting it after I make the exchange.  
So that's another week or so of hoping I don't drop my phone face first, or just wasting that money buying the case out of pocket.  
Oh and they were also apparently out of my first choice of color too, they only told me that in Novemeber.  
   
My only question is: WHY?  
Why can't I just go to a service center somewhere, hand in my phone and get the new one. I'd take an Uber to some random warehouse in the outback if it would be faster.  
Why can't they just email me the voucher, or hand it with the courier who is apparently authorized to handle a $1000 device.   
  
I was still a Samsung fan after the first recall, now this second recall is has killed any brand loyalty to Samsung. If one more thing messes up with this process I'm not even going to consider them for my next phone.  

/Rant over",SYLOH,1478335289.0,2016-11-05 16:41:29,11,9,https://www.reddit.com/r/samsung/comments/5b9232/getting_really_frustrated_with_the_note_7/,samsung,Note 7 recall
510gh0,Note 7 Cracked..recall?,"I got a Note 7 through Sprint on release day and noticed last night my phone getting warmer than usual. When I turned on the phone, it had a small crack on the top of screen. Will Sprint still let me return phone for the recall?? thanks ",Noahgreyyy,1472932154.0,2016-09-04 03:49:14,6,9,https://www.reddit.com/r/samsung/comments/510gh0/note_7_crackedrecall/,samsung,Note 7 recall
52emjx,"Is it only the Galaxy Note 7 being recalled, or the Galaxy S7 / Edge? Canada if it matters","I tried googling through some results, but everything I find just talks about the Note 7, although I have heard of the S7 and S7 edge exploding as well.

Is there a Recall on the S7?",HiddenTextInSource_,1473690990.0,2016-09-12 22:36:30,3,8,https://www.reddit.com/r/samsung/comments/52emjx/is_it_only_the_galaxy_note_7_being_recalled_or/,samsung,Note 7 recall
5h18ql,Samsung hasn't shipped me a Note 7 return box yet. I'm moving to another state in two week and I have no idea what to do,"I purchased a note 7 directly from Samsung.com.

After receiving the device, I moved from the west coast to the east coast. Once I heard the news about the recall, I contacted Samsung and informed them that I have moved and that I'm requesting a refund. The agent assured me that shouldn't be an issue and that I should be receiving a return package within 3 to 5 business days. As far as I know, the package went to my old address.

Ever since then, I have been calling Samsung at least twice a week. Every time I call, I get the same answer, we made a mistake, we fixed it and that I should be receiving a return package within 3-5 business days.

I started this process around Oct 11th. It's now Dec 6th. I have called Samsung more than 35 times and I have spent more than 9 hours speaking to various agents and supervisors (have records from Sprint that proves this.)

I'm moving out of the state I'm in now in two weeks. I'm extremely worried that I won't be getting a return package before then. Because I'm not allowed to fly with this phone, I have to leave it behind. It is not fair to lose the money I have spent on this phone because Samsung seems to fail at sending me a package. I'm absolutely desperate.

I have tried reaching out to their their social media team and they referred me back to the phone numbers I have been calling for the last seven weeks. I emailed Samsung ecommerce team and I haven't gotten any responses back. I contacted my carrier (Sprint) and they said they can't do much for me because I bought the phone directly from Samsung.

A typical day for me now: http://imgur.com/WynFXuX",vitareem,1481132246.0,2016-12-08 01:37:26,2,6,https://www.reddit.com/r/samsung/comments/5h18ql/samsung_hasnt_shipped_me_a_note_7_return_box_yet/,samsung,Note 7 recall
51mixz,Note 7 recall question.,So as I was working today my phone hit my leg quite hard and of course damage was done. Right under my home button is a tiny tiny spider crack aboiut a 1/4 the size of the button itself. With the recall are they gonna hit me for stuff like that?,BrodiakBear,1473270325.0,2016-09-08 01:45:25,2,6,https://www.reddit.com/r/samsung/comments/51mixz/note_7_recall_question/,samsung,Note 7 recall
523zdp,Discussion: How long do you think it will take to the Note 7 hit the market again?,Pre-ordered mine and now i'll have to wait longer xD! Really hope it doesn't take long but maybe only in october.,bernard0z,1473526583.0,2016-09-11 00:56:23,5,5,https://www.reddit.com/r/samsung/comments/523zdp/discussion_how_long_do_you_think_it_will_take_to/,samsung,Note 7 recall
51na1m,Anyone been able to exchange a recalled Note 7 for a new Note 7 yet?,,morriwi,1473279061.0,2016-09-08 04:11:01,4,5,https://www.reddit.com/r/samsung/comments/51na1m/anyone_been_able_to_exchange_a_recalled_note_7/,samsung,Note 7 recall
50vfxn,Returned Note 7 to T Mobile for recall.,"I went today to the T-Mobile store to see what was going on. First, T mobile website claims that the Note 7 devices can be turned in for a full refund (or whatever you've paid on lease/jump) In addition, any accessories can be returned.

The T-Mobile reps were probably the worst, none of them knew anything. I had to explain to them the post on their own website, the TMobo Manager was dumbfounded. All they knew was to stop selling Note 7 devices. So the manager called HQ or whatever is there store's head. They further prompt her to take my device(Note 7) and:

Option 1:
-Refund any payment made for the phone ($69.99 upfront cost and a monthly charge $40) 
-I brought back the S view case (without packaging and Gear VR) and they provided a full refund to my card. (No, restock fee) 
-Third they drop a Jump! on Demand and let me Jump! to another phone (I took the iPhone 6S for now, maybe wait for the note 7 or iPhone 7 ill see.)

Option 2:

-Keep your Note 7, let them put a note and request on your account that you want a new Note 7 and wait an estimate of two weeks for new stock of Note 7 that are ""fixed"" They told me it will be a brand new box/phone that I will receive.

Note: 
I took option 1, because I didn't want the Gear VR and S View Case so I found the perfect opportunity to get a refund. Also, GO TO YOUR THE T MOBILE YOU BOUGHT YOUR PHONE. I went to a different T mobile store they sent me to my original store. My phone also had hairlines cracks and they still took it. Maybe everyone will have different experiences, but here was mine. Overall, company policy was great no complaints, the T mobile reps sucked.

Edit: Also got to keep my Netflix sub too.",Yimyorn,1472849687.0,2016-09-03 04:54:47,2,5,https://www.reddit.com/r/samsung/comments/50vfxn/returned_note_7_to_t_mobile_for_recall/,samsung,Note 7 recall
59myob,Samsung’s Q3 profits are way down after Note 7 recall,,theargamanknight,1477557782.0,2016-10-27 16:43:02,7,4,http://www.theverge.com/2016/10/27/13431750/samsung-q3-profits-down-note-7,samsung,Note 7 recall
58dawf,What's the best way to contact Samsung about not being pleased with how they handled the note 7 recall?,,FalconsFever,1476916652.0,2016-10-20 06:37:32,6,4,https://www.reddit.com/r/samsung/comments/58dawf/whats_the_best_way_to_contact_samsung_about_not/,samsung,Note 7 recall
51pecv,[Help] Note 7 Recall - Backup using MicroSD Smart Switch?,"Hey everyone,

Soon I'll be going for the exchange program, and where I'm from we are only offered the option of backing up through Smart Switch via MicroSD card or Smart Switch PC. 

I've only used the Smart Switch via USB Cable and everything was exactly the same(home screen, wallpaper & apps etc) when transiting from my old Note Edge to the Note 7.

My question is, does Smart Switch via MicroSD work the same as via USB? It seems to have backup'ed everything I have selected to my MicroSD card, and just need to insert and restore into the new set, but I have no way to find out if it's the same as Smart Switch via USB. Anyone have experience from doing this and can share some insight? Much appreciated.

EDIT: Does content in the Shared Folder get backed up too?

[Here's the Image](http://imgur.com/a/3JwMq) of the provided How-to in case anyone needs it.

",NutellaDiamonds,1473306133.0,2016-09-08 11:42:13,13,3,https://www.reddit.com/r/samsung/comments/51pecv/help_note_7_recall_backup_using_microsd_smart/,samsung,Note 7 recall
51r7g1,I'm guess the promotion still goes on when the note 7 becomes available again?,,SweetThuy,1473340112.0,2016-09-08 21:08:32,16,2,https://i.reddituploads.com/dde8a102cf814c219d721a80f2ff1229?fit=max&h=1536&w=1536&s=0d438a6ec1f25314734e35b0e84e07c0,samsung,Note 7 recall
52unyq,How do I return Note 7 from Samsung.com?,"I've been trying to return this Note 7, and have called on several separate occasions to orchestrate an exchange.  Two weeks ago on Wednesday I called and asked for a return, and they said that they would send me an email with a return slip.  This Monday, I called back and asked them again for a refund, and they said that it would take 3 business days for FedEx (not samsung) to send me a return slip.  Tomorrow is the last day that they have to send me this shipping email.  If they don't send me a return slip, what are my options here? I checked out online as a guest, so I cannot initiate a return through the website.  I know no-one would buy this since its a pre-recall Note 7, so what real options do I have?",Rgcolli1,1473915558.0,2016-09-15 12:59:18,3,3,https://www.reddit.com/r/samsung/comments/52unyq/how_do_i_return_note_7_from_samsungcom/,samsung,Note 7 recall
5c3do3,Issue with note 7 recall,"Just thought I would share my predicament and maybe reach out to others for some suggestions:

So I bought a Note 7 within the first few days of the launch here in Canada from a local Best Buy. 

 

Since I used a Note 4 for personal use on a grandfathered Telus plan and a Note 5 for a work line, I was planning on using the Note 7 as my new personal line phone. 

 

However, since Best Buy would not sell the phone outright to me in the color that I wanted, I was forced to start a 2 year contract with them for a 3rd line, paying the approximately $600-700 for the 2 year contract, which I immediately cancelled and transferred the phone to my personal line, fully expecting Telus to charge me the remainder of the phone (Approx. $400).

 

Now this would normally be no issue whatsoever, but now due to this recall, I must return this phone.


Having spoken at length several times with both Best Buy (the purchasee) and Telus ( the service provider, they have both stated that I can either:

 

A) return the phone and case to Best Buy for the amount they charged me (~$600)

 

   OR

 

B) return the phone to telus for a refund (~$500)

 

My only other recourse would be to work with Samsung directly, which comes from the advice from both above parties, but all I've been able to do is email their enrsupport@samsung which just asks for info on shipping. That was last week and I have not heard a reply,  and even then I don't know if they will refund me the full amount or just what I have on the best buy receipt. 

 

This creates a problem for me as I am now out either $600 or $500 for something that is not my fault. I currently do not want to trade for an S7 Edge, as I feel it is outdated after using the Note 7 which has been my favorite phone to date by a large margin, and the only other phone I would want is a S8 which is a long time away, Which is why I am seeking to get a full refund, and revert back to my note 4 for the time intrim.

 
Anyone who might have been in this situation find a resolution?",captainmavro,1478722101.0,2016-11-10 04:08:21,2,1,https://www.reddit.com/r/samsung/comments/5c3do3/issue_with_note_7_recall/,samsung,Note 7 recall
56q8i5,Samsung recall crisis deepens; Yonhap reports Note 7 production halt,,ksweeley,1476072880.0,2016-10-10 12:14:40,2,0,http://www.reuters.com/article/us-samsung-electronics-smartphones-idUSKCN1290XH,samsung,Note 7 recall
52ablo,Note 7,When will the UK see other colours other than black and blue? I'd rather silver/gold. I had my pre order for black refunded after the recall and holding onto my iPhone 6 plus still waiting for them to sort the recall out.,jonnyflit,1473623559.0,2016-09-12 03:52:39,2,0,https://www.reddit.com/r/samsung/comments/52ablo/note_7/,samsung,Note 7 recall
59ppwi,"Cracked S7 Edge screen, options?","So the other day I dropped my S7 Edge and messed the screen up pretty bad. On top of that, the display is now super bright and barely usable. Everything still seems to work otherwise.

I called around the local repair shops/kiosks and everyone says about $400 to repair it. I called Samsung and they said they would do it for $260 but then immediately told me that their repair program is ""temporarily"" suspended due to business conditions (aka Note 7 recall). I was directed to a Best Buy where there's a Samsung rep, was told they could fix it there, but then when I got there the guy told me that he couldn't. Called Samsung again and was told about walk-in service centers in NJ, NYC, and LA, the closest of which is not even an option.

I'm just incredibly frustrated that it seems like my only option is to pay a third party $400 to fix it. I understand it's my fault that I dropped it but I feel like Samsung has completely hung me out to dry. Everyone I talk to is in shock by how much a screen replacement costs for this phone.

Does anyone have any other suggestions? All I want is to pay for Samsung to fix it so I know it's a quality repair.",mmuoio,1477593965.0,2016-10-28 02:46:05,7,22,https://www.reddit.com/r/samsung/comments/59ppwi/cracked_s7_edge_screen_options/,samsung,Note 7 recall
52hxiu,Is the Gear VR worth it?,Thinking of exchanging my note 7 in for thr recall and switching it to the edge specifically for the free Gear vr promo and wondering if it's worth it?,jayjay81190,1473729816.0,2016-09-13 09:23:36,4,19,https://www.reddit.com/r/samsung/comments/52hxiu/is_the_gear_vr_worth_it/,samsung,Note 7 recall
5kpx36,Holding out hope for S8...,"So, I work for Samsung... I LOVED the Note7. Everything about it was great... exept for the whole blowing up flaw. Rumors abound say that Samsung will likely stop continuation of the Note line, and that the Galaxy S line will be the flagship going forward. That said, one of the best things I loved about the Note was the bigger screen, and the s-pen. I can live without the pen, but if the actual phone size rumors of 5.5 and smaller are to be believed, I think I will be done with Samsung phones for the forseeable future. I reverted back to my Note3 when they forced the Note7 Recall and it's beginning to show it's age. I'd REALLY like for the 6.2 rumor to be true, but I could live with 5.7, anything less than 5.7 and i'm outtie...",Aviconus,1482926562.0,2016-12-28 20:02:42,9,12,https://www.reddit.com/r/samsung/comments/5kpx36/holding_out_hope_for_s8/,samsung,Note 7 recall
51pf5f,Other: After seeing today's iPhone 7 Launch...,"I just want Samsung to let me purchase a Note 7! Seriously, recall be damned, how long until I can get one on AT&T in the states?



**EDIT** According to Samsung's live chat support, the Note 7 will be back in stock as of next week!",MoreThanLuck,1473306443.0,2016-09-08 11:47:23,7,13,https://www.reddit.com/r/samsung/comments/51pf5f/other_after_seeing_todays_iphone_7_launch/,samsung,Note 7 recall
513fbr,Anyone have any idea when samsung will start sending out note 7's again?,"AS we know, over 20 note 7's has exploded due to faulty batteries out of 1 mill, and a few days ago they recalled lots of the note 7's. But do anyone know how long time it will take until it gets an official date again? Cause me and my GF awaits our upgrade as i have preordered, but she couldn't. (her note edge suffers from heavy battery drainage with wifi and other deffects that waranty apparently doesn't give 2 shits about because samsung's software department sucks)",Silithas,1472983930.0,2016-09-04 18:12:10,3,12,https://www.reddit.com/r/samsung/comments/513fbr/anyone_have_any_idea_when_samsung_will_start/,samsung,Note 7 recall
5farsu,Samsung Korea basically stole my money.,"I've never done a chargeback before, so I'm not sure entirely about them, but should I in this case? I used a foreign credit card to purchase my Note 7, upon exchanging it for the recall I got an S7 Edge and they made me pay for the S7 Edge and were going to refund the Note 7 amount to me in a few days, but now today they call and literally tell me ""Yeah we can't refund it, dunno what we should do. I'll call you back in 4 weeks."" What the fuck is that shit? 4 weeks they say they'll contact me, and they tell me literally nothing about how I'll get my 1000 dollars back? 

It actually gets even worse, the guy at the Samsung service center when pressed for more information about how I'm going to get my money back told me he doesn't want to deal with me anymore and hung up.",CL60,1480324616.0,2016-11-28 17:16:56,2,7,https://www.reddit.com/r/samsung/comments/5farsu/samsung_korea_basically_stole_my_money/,samsung,Note 7 recall
58t6hm,Help with restoring Samsung backup without Samsung phone.,"Hi all, due the Note 7 recall I returned my Note 7 and am now using the Pixel (Don't hate >_>). Unfortunately I made the mistake of using Samsung account to backup contacts and texts etc.

Does anybody know a way of restoring data from a samsung backup with a samsung phone? 

Thanks.",HatTheJack,1477143807.0,2016-10-22 21:43:27,4,5,https://www.reddit.com/r/samsung/comments/58t6hm/help_with_restoring_samsung_backup_without/,samsung,Note 7 recall
54ic1q,Samsung Wireless Quick Charger Issue,"I have used this charger with a pre-recall Note 7 and 2 S7E's without any issue.  On my new Note 7 it won't connect on quick charge, it just says Wireless Charging and it's not charging the phone faster than the battery is draining.  Any ideas on how to trouble shoot this?",Markinlv,1474854094.0,2016-09-26 09:41:34,3,5,https://www.reddit.com/r/samsung/comments/54ic1q/samsung_wireless_quick_charger_issue/,samsung,Note 7 recall
52gnbl,Need Verizon replacement advice,"I read through the Verizon release concerning the Note 7 recall and it seemed vague in not mentioning the exchanged device being a loaner or being able to swap that loaner in for a replacement Note 7 once they were available. All the other carriers specifically mentioned being able to swap again for another Note 7. So, I called Verizon and, after a lengthy conversation in which he claimed he wasn't aware of a Note 7 recall (seriously? How are you not aware? He said the recall was the S7 Edge. I told him to check again, but that is beside the point), he finally found the information and read it to me that I would be able to swap again for a replacement Note 7. 

So, I headed off to my local corporate store. My local store is a regional sales office I believe. This is important to the story. 

I was told by a rep there, and again by the store manager, that I could only swap once and whatever device I swapped for was the one I was stuck with. No additional swap for another Note 7. I had 3 choices; keep my existing Note 7 and wait to see if the replacements come in before Sept 30, swap before then and settle on a different device, or activate an old phone on my account and return the Note 7, losing my 2GB bonus data, and then upgrade to a new Note 7 once they become available. I left ticked off. 

I called Verizon back, spoke with another person who said the manager is incorrect and confirmed the original information; I can swap now, for a loaner, and get a replacement Note 7 when the come in. 

So what's the true story here? If the store manager is refusing to honor this, I'm not sure what to do. I've want the Note 7. I've spent money on Note 7 accessories (are they refunding those? If so, who? Verizon or Samsung?). 

Can someone advise on what they've done?",cmcfalls2,1473713858.0,2016-09-13 04:57:38,2,5,https://www.reddit.com/r/samsung/comments/52gnbl/need_verizon_replacement_advice/,samsung,Note 7 recall
524trg,Note 7 Bedside Charging Station,,BillNyeDeGrasseTyson,1473537290.0,2016-09-11 03:54:50,335,53,http://imgur.com/ZaMJpiS.jpg,samsung,Note 7 recall
