id,title,selftext,author,created_utc,created_date,score,num_comments,url,subreddit,search_query
581lui,Samsung is considering giving Note 7 owners that switched to an S7/S7E the option to swap for an S8/Note 8,"I just saw it on the news here in Korea. If you changed to an S7 line phone they are considering letting you change to an S8 or Note 8 when they release.


EDIT: Somebody on the Note 7 subreddit also saw this, and also provided a link to the news story. 

http://www.asiatoday.co.kr/view.php?key=20161017010009913

It's in Korean but it says Note 7 owners that switch to a S7 phone can swap that one for an S8 or Note 8 when they are released.",CL60,1476759577.0,2016-10-18 10:59:37,146,48,https://www.reddit.com/r/samsung/comments/581lui/samsung_is_considering_giving_note_7_owners_that/,samsung,Galaxy Note 7
52fxnd,Please Return Your Samsung Galaxy Note 7 During The Recall,,swipetounlocknews,1473705925.0,2016-09-13 02:45:25,76,59,http://swipetounlock.com/please-return-your-samsung-galaxy-note-7-during-the-recall/,samsung,Galaxy Note 7
4vjxjb,"If Note 7 Rumors are true, isn't s7 edge better?","Hi all,

As the title suggests...

The Note 7 is rumored to be 5.7"" (0.2"" larger than S7E), with a smaller batter (3,500mAh v 3,600mAh). AND it's rumored to have identical RAM, processor, waterproofing, camera etc to the S7 and S7E.

Am I right in thinking that the only advantage the Note 7 has over the S7E is a larger screen, an iris scanner (gimmicky idea, doubt it will be used more than fingerprints) and the stylus?

This phone will be 5 months older than the S7/S7E, with virtually identical specs, as well as a (presumably) higher price tag than the S7E.

Or am I missing something??",Charrzooka,1470011949.0,2016-08-01 08:39:09,32,61,https://www.reddit.com/r/samsung/comments/4vjxjb/if_note_7_rumors_are_true_isnt_s7_edge_better/,samsung,Galaxy Note 7
4wni3j,Is the Note 7 worth the $200 over the S7 edge?,"Hello, I currently have a Note 3 that I am frustrated with. It freezes all the time, tons of battery issues..

Thinking about getting a Note 7, but the issue with it is that an unlocked version isn't out yet.

 I am considering an unlocked Galaxy S7 edge which costs about $650.

Should I just try to wait until the unlocked Note 7 or go ahead and buy the S7?

",FatRonaldo9,1470615007.0,2016-08-08 08:10:07,22,54,https://www.reddit.com/r/samsung/comments/4wni3j/is_the_note_7_worth_the_200_over_the_s7_edge/,samsung,Galaxy Note 7
50sdb5,Global Note 7 recall official,,YoDup,1472807796.0,2016-09-02 17:16:36,49,44,http://www.theverge.com/2016/9/2/12767670/samsung-galaxy-note-7-recall-fire-risk,samsung,Galaxy Note 7
561616,Replacement Galaxy Note 7 Explodes During Boarding of a Southwest Flight,,GnarltonBanks,1475694244.0,2016-10-06 03:04:04,33,43,http://gizmodo.com/galaxy-note-7-explodes-during-boarding-of-a-southwest-f-1787447287,samsung,Galaxy Note 7
57ieph,The Galaxy Note 7 will be banned from all US airline flights,,kdcurry,1476475445.0,2016-10-15 04:04:05,39,38,http://www.theverge.com/2016/10/14/13288978/samsung-galaxy-note-7-flight-ban-faa-us,samsung,Galaxy Note 7
4wvn6s,Huge pre-order numbers mean Samsung can taste success with the Galaxy Note 7,,JohnnyDoran,1470741077.0,2016-08-09 19:11:17,48,34,http://www.digitaltrends.com/mobile/galaxy-note-7-pre-order-record-beating-news/,samsung,Galaxy Note 7
56pmf7,Samsung temporarily suspends production of Galaxy Note 7,,InsleepTech,1476064945.0,2016-10-10 10:02:25,59,30,http://cnb.cx/2d5MzJn,samsung,Galaxy Note 7
4x2azp,Note 7 Display Gets Record High Max Brightness,,EAGLESWhit,1470838313.0,2016-08-10 22:11:53,31,31,http://swipetounlock.com/note-7-display-gets-record-high-max-brightness/,samsung,Galaxy Note 7
4vu8ni,"News: Samsung Galaxy Note 7 goes official with USB Type-C, iris scanner, water-resistant body and more",,OverturnedCanoe,1470165316.0,2016-08-03 03:15:16,19,22,http://www.sammobile.com/2016/08/02/samsung-galaxy-note-7-goes-official-with-usb-type-c-iris-scanner-water-resistant-body-and-more/,samsung,Galaxy Note 7
4xw4gs,Galaxy Note 7: Is the S-Pen the biggest selling point?,"I have a phone upgrade available this Friday, so I have the choice between the S7 Edge and the Note 7. Personally, I don't know how much I'd use the S-Pen (I've never really used a stylus besides my 3ds). 

From what I've read, the S-Pen is the only major upgrade besides the larger screen. Should I get the Edge for the better battery life/cheaper price? Or should I get the Note because it's the newest toy on the market? ",Codist22,1471298858.0,2016-08-16 06:07:38,12,22,https://www.reddit.com/r/samsung/comments/4xw4gs/galaxy_note_7_is_the_spen_the_biggest_selling/,samsung,Galaxy Note 7
5i3uj9,Samsung to bring Galaxy Note 7′s Y-OCTA display to the Galaxy S8.,,RenegadeUK,1481639291.0,2016-12-13 22:28:11,26,19,http://www.sammobile.com/2016/12/13/samsung-to-bring-galaxy-note-7s-y-octa-display-to-the-galaxy-s8/,samsung,Galaxy Note 7
50hcu8,Samsung suspends Galaxy Note 7 shipments after phones explode while charging,,Diazepam,1472652544.0,2016-08-31 22:09:04,39,14,http://bgr.com/2016/08/31/galaxy-note-7-explosions/,samsung,Galaxy Note 7
4xi09p,24 Hours with the Samsung Galaxy Note 7: Oh Yeah!,,NigelKF,1471070787.0,2016-08-13 14:46:27,30,15,https://youtu.be/Ua8kQtRqzRw,samsung,Galaxy Note 7
5ef6kq,Galaxy Note 7 recall did not damage Samsung brand in US: Poll,,dunkin1980,1479872154.0,2016-11-23 11:35:54,30,14,http://www.cnbc.com/2016/11/21/galaxy-note-7-recall-did-not-damage-samsung-brand-in-us-poll.html,samsung,Galaxy Note 7
522ivy,US to Galaxy Note 7 users: Power down now,,XanderaTheMander,1473502702.0,2016-09-10 18:18:22,18,16,http://www.thejournal.io/a/1076080-us-to-galaxy-note-7-users-power-down-now,samsung,Galaxy Note 7
4zc7h2,Samsung Galaxy Note 7 Reportedly Exploded During Charging,,Diazepam,1472040065.0,2016-08-24 20:01:05,4,16,http://www.androidheadlines.com/2016/08/samsung-galaxy-note-7-reportedly-exploded-during-charging.html,samsung,Galaxy Note 7
51af8t,How to return your Note 7 to AT&T,"I work closely with AT&T and saw their internal communications on the matter so here's what's up:

Ideally, return it to the store you got it from or the closest store to you.  However, if you tell them you can't make it to a store they *will* process the return over the phone and will actually have you hold onto the phone until they send you return instructions (not available as of yet)

They will replace the phone with literally anything.  The communication says to push for other Samsung products, but they are allowed to replace it with any phone, so if you want to take this opportunity to try out something different, then you are welcome to.

Of course, this is all just if you got your phone through AT&T and not through a 3rd party or Samsung.

TL;DR:  Go to a store or call and say you can't get to a store.  Choose your own replacement",RichardMcNixon,1473095565.0,2016-09-06 01:12:45,23,13,https://www.reddit.com/r/samsung/comments/51af8t/how_to_return_your_note_7_to_att/,samsung,Galaxy Note 7
4wuua9,Special Version Of Galaxy Note 7 Confirmed By A Dealer In China.,"Few days ago, SAMSUNG just updated its Galaxy Note 7 official record on China's Ministry of Industry and Information Technology's website. Based on the record, we can see the a special version with 6GB + 128GB will be released. Yesterday, there is a dealer in China also exposed the price and release date of Galaxy Note 7 in China.

From the information we have, the special version is only for China. The price of the normal version is CNY5688 (~USD853), the special version is CNY6088(~USD913). SAMSUNG and other official dealers will accept pre-order on Aug 28th and it will be released on Sep 2nd.

That dealer also said, the Google already optimized Android for 6GB RAM version Galaxy Note 7 and it will be released with the phone.

We don't know the exact model of the special version right now, but we can see there is a SM-N9300, which is the model of normal version, on Geekbench's website with 6GB RAM.",babibada,1470725065.0,2016-08-09 14:44:25,5,14,https://www.reddit.com/r/samsung/comments/4wuua9/special_version_of_galaxy_note_7_confirmed_by_a/,samsung,Galaxy Note 7
4w9nli,china will have a new galaxy note 7 edition with 6GB RAM and 128GB ROM.,"I just checked China's Minister of Industry and Information Technology's website, Samsung has updated their official record, it says there will be a new edition of Note 7 with 6GB RAM and 128GB ROM. Not sure if the CPU will be changed, also. I tried to google something, but nothing helped me know if it's for China only. I hope Samsung will also release this model to other countries. I am considering stopping pre-order Note 7 but waiting for some news.",babibada,1470390584.0,2016-08-05 17:49:44,20,12,https://www.reddit.com/r/samsung/comments/4w9nli/china_will_have_a_new_galaxy_note_7_edition_with/,samsung,Galaxy Note 7
52scvp,Note 7 T-Mobile Experience and Exchange [Rant],"I want to begin by saying I'm a long time supporter of Samsung and their products. From TV's, washing machines, dishwashers, fridges, cords,headsets, and phones I have always stood by them. I am a registered Platinum Member in fact and I just want to make it clear I'm not bashing them in anyway and think they are handling this as best as they can however it is quite a shit show. 

(Feel free to go down to the exchange heading if you are only interested in that however I'd appreciate your time)


* **Purchasing**

I purchased the phone day 2 in store (using Tmobiles old jump program as Im grandfathered into it) and was told it was gonna be mailed as it was out of stock in store. I had travel planned at the end of the coming week and wanted to have the phone for it. In the store I was told 4 business days tops and since it was a Friday and I wasn't leaving until the following Friday that I'd be fine. Trusting in this I opted against going and buying it outright somewhere else and having to deal with activating it. I checked my Tmobile account daily starting Saturday where I saw it said my note 5 was my ""trade device"" and then there was just nothing under the ""new device"" tab. I wasn't concerned figuring it had just went through no big deal. Sunday- nothing no change. Monday-no change and I was at this point figuring the site must have a bug and just not show it. Now I waited until Wednesday to check again seeing then that still no progress had been made. I had received an email the day prior with a tracking number but when I looked it up USPS said nothing was found. So now Thursday morning I decide that there must be a problem as nothing had changed. 

So I call in and the rep asks me for my account info and upon pulling it up she too cant see anything for my new device. She is apologetic but after 15minutes of her trying to get into the account she gives up and says she'll need her supervisor. I wait another 10 minutes and she comes back and says she still wasnt able to totally open the account however she can track it and says its at my local post office and out to be delivered. Great! I thank her and hangup. Where I live they don't deliver mail so when mail is being delivered it just means they are sorting it to your box so I head down to the post office.  I know the postman well and he says he hasn't got anything for me and checks the whole data base and nothing comes up.  So now I'm showing him the tracking number in the email tmobile sent me and he immediately sees that for whatever reason they doubled the numbers up and thats why it wasnt working so he checks the number and is able to tell me that not only have they not shipped it but not even gave it to USPS all they have done it print a label. So I return home and call again to find out why they told me it was shipped. The gentlemen I speak with tells me he's sorry and has no idea where this other agent got this info from. On top of that he's sorry to say that it wont probably ship for a few days still as its back ordered. I ask why no one told me and just get more sorrys. So fast forward to 3 days later I return and finally have the device.


* **Ownership**

Now once I got it I had a little problem transferring my old data using the included connector and cord. Ended up using the old wireless system and synced quickly. Now I had no problems from here on out other than I noticed it got quite warm but I use fast charge battery packs as I'm on the go often so whatever I think nothing of it as my note 3 got warm way back when it had just came out. 

Fast forward to D-Day its top news every where that note 7's are bursting into flames. Shit. So I now begin to only charge while I'm watching it and in a metal bin whatever not a big deal however whats the plan what am I to do with the other 2 million people. 

I get that answer days later when a message is given that all retailers are gonna be issuing some sort of return process and give a loaner phone. Eh well okay at least they are taking care of me. Well not really days go by and I hear what some carriers are doing but nothing from T-Mobile hell not even an email from them that I have a recalled piece of equipment that is a possible hazard to my health. 

Finally I get an email from them that says I have 3 options. 1.sign up to be told when the new phone is ready 2.Switch to a new device totally forever or 3.Return for full refund

I call in to see if I can exchange like I heard other carriers are doing for just a loaner phone. I'm given a resounding NO that I'd be at that point choosing option 3 and returning and that I'd be getting the loaner phone on my own dime and I could just hope that within the 14 day return period that I'd be able to get a new note 7. Ha no way. I'll just be careful with the phone. Now almost a week passes and I got the text from yesterday saying that now they are really gonna take care of me. This is quotation directly from the page.....

""We’re making it easy for you to exchange your Galaxy Note7 for free.

Just head into one of our retail stores to exchange your device. We’ll take care of the rest. Or you can call us today at 1-844-275-9309. We’ll ship you any device of your choice in our inventory with free next business day shipping. You can keep it or use it as a “loaner” until the new Note7 is available.""

If it looks to good to be true...

* **Exchange**

So after my past experiences there is no way in hell I'm calling in when I'm given the option to handle this in the store as they tend to be a lot more accountable when we are face to face. So I go in and have a group ahead of me in line browsing the store so I sit down on the side and wait. The female rep asks if anyone is here to pay a bill or anything like that, that'll be quick I say yeah I'm just here to exchange for my loaner phone from the note 7 program. She is visibly displeased and lets me know that its a 30 minute process. I say okay thats fine I can wait to which she says well the last one took 45 minutes I say okay thats still fine I can wait. 15 minutes pass and a manager comes from the back letting me know I need to just call in to handle this as the store isnt capable and hands me a paper with the number written down. I let him know that the message I received from T-Mobile said quite the opposite to which he says there is no way he can exchange it in store as the hotline has the only system that allows the process and tells me he's sorry but over the past few days they tried to do it in store and simply couldn't as they don't even have the stock of s7/s7 edges to give out loaner phones.

I finish my errands return home and immediately call and get quickly connected to Amy. Amy is quite chipper and lets me know the process is quite simple and all I need to do is head in the store and I'll be taken care of with an exchange loaner device of my choice. I laugh and let her know what I was told and she becomes concerned and says there is no way that could have happened as, as soon as the store sees a note 7 they are too immediately exchange  for any device even if all they have is Iphones as its considered a liability and safety concern. So I tell her then please note this information exactly on my account and I'll head back in. She notes it all with policy numbers even and I drive back.

Upon arriving the store is armed with different employees from earlier except the female rep running the counter. She immediately goes in the back bringing a new manager who asks me, ""How can I help you?"" I tell him the situation and how I was already here and he says that the number I was given is the only thing he can do to help me. I explain that this is not the case and that I have notes on my account that should explain it clearly. He checks and says that this is old information and is not what his District Officer advised him on. He offers I call from the store phone and just try again. I oblige and speak with John. John tells me within 30 seconds that I can just head into a store to get my loaner. I ask him if he could hold for just one moment and tell that to the T-Mobile manager sitting across from me. They now I kid you not go back and forth for 15minutes telling each other different policys and how each other are wrong. I'm nearly laughing at the ridiculousness of the situation as 2 reps of the same company tell each they don't know policy. He eventually hangs up and tells me he is sorry but these guys on the phone don't know what they are talking about as there ""system doesn't just have a magic loaner button"". I tell him I understand but what am I to do as I'm just getting the run around no matter what I do. He says the main problem is, that my note 7 when I got it had a tax charge as all things do when they leave the store. He says that there is no way for me to get a tax charge in there system therefore he cant give me anything as thatd be illegal. I tell him that I understand the predicament but uhh what do I do? He then tells me he's gonna try a few things with his other employee. They spend 20 minutes and get no where. He then says he is trying to contact the District Officer or someone higher up but it could take a while. Sure why not I can wait. 45 minutes go by and still nothing. Now they are just trying different things in the system and finally come up with a way to get me a new device. However its gonna use an upgrade and also is outside the ""hotline loaner program"" therefore I'm now not entitled to a note 7 when they come out but he says he can make it note but its not legally binding and he cant promise anything. Yeah no way so he says just try and call in again tonight. 

I leave defeated and as I'm driving home I pass Verizon. Out of curiosity I pull over and look up the location and call them. I speak with John and ask him what is the process for the note 7 debacle. He is very friendly and says that for now all his location is doing is giving full refunds and thats it. I come clean and tell him I'm not with Verizon but T-Mobile and tell him my situation. He asks which location did I go too. I tell him and sure enough he says he used to work there and that they are know as the ""idiots of the district who always call in and end up just throwing there hands in the air and give up"" Wow great. He then in detail explains to me what they should have done in the system as he knows it well when he worked there and I tell him the problem with taxes to which he replies should be a non problem as when they refund the first note 7 I should get a credit for the original tax. Nevertheless he tells me to go to this other T-Mobile location he was at and gives me employee names to speak with. I thank him and return home.

Now I decide I'll attempt this hotline one final time. Dana picks up and listens to it all and says she is sorry I'm going through this and can't believe the disconnect from the stores and hotline. She though is able to actually send me a loaner over the phone and works with me to get all the info. She asks what phone I want to which I decide why not try an Iphone 6s+ as I havent had an Iphone since the original 5. So she confirms it all and I think back to a problem I've had in the past when I moved a few months ago. There was a wrong street number which I had called and had ""fixed"" twice in the past so I ask her what address she is sending to and of course its wrong. Jesus Christ, I tell her its wrong and she corrects it and the call concludes telling me to sign my EIP when it comes to my email. 

FINALLY this nightmare is over.... right? Well 2 hours pass and I get the email and sign it. And its now almost midnight, what a day. I get the final confirmation email and read it over. Yep you know it guess what was wrong??? The address. Still. Wrong. 

**(I actually started writing this post at this point but got even more content to write lol)
**
I'm now finally at my wits end, I've kept calm all day and been very understanding but now I'm pretty sure I'm gonna have a heart attack. I call its 12:02am and I speak with Ieasha who hears a very abbreviated gloss over the situation to which I tell her I just need the address fixed on my current shipment. Guess what no she cant. Once the EIP is signed it cant be canceled. She tries for 20minutes and has me explain the whole situation. She then says shes gonna have me talk to a supervisor who she has explained how crazy this has gotten. 

Kendall the head supervisor is now talking to me who says she is gonna put this to bed no matter what it takes right here and now. I tell her that this is my last call to T-Mobile as otherwise I will be going in and demanding full refunds and canceling my 5 year long account with them. I let her know the entire problem and go into detail with the exact disconnects I see between the stores and hotline. I tell her about how I had them even arguing over the phone on what policy was. I conclude the story with telling her that as the customer I have done my due diligence and that this is in her hands to get higher ups to hopefully fix this nightmare of a system. She admits her displeasure with how ridiculous this all is and even laughed at how stupid this must look. She reiterates that she cant cancel this order at this point and has tried. However she is gonna just credit me the entire cost of the Iphone and send it free. Even going as far as to sends case and screen protectors. She asks that I please call in the morning using Dana's direct line and have her deal with calling UPS to stop the shipment when they get it. She says that she'll not be working for 2 days but will make sure that its all dealt with when shes back to be sure there are no problems. She says to also hold my note 7 as collateral until they send me a note 7 in the future which they should call about in the coming weeks.  I thank her and finally set down my phone. 

Its 1am and I have two 800 dollar iphones, case, and screen protectors coming and it only costed me about 7 hours of calls and sitting in the store, a few gallons of gas, and about 98% of my patience.

Morning comes and I call Dana's line as soon as she is supposed to be on duty as I have her hours for the next few days written down. No pickup. I call a few times over the next couple hours and finally decide to just call the note 7 hotline again and the rep sees the note on my account and says she will deal with UPS. 

So that's it not too bad right? I hope my slightly ticked demeanor is understood but this was the craziest experience in recalls I have ever dealt with. Worse than car recalls where I have had family get free cars worth over 20k once all was said and done. I write this to vent and also get the word out that there is a clear problem at T-Mobile that hopefully Kendall gets the word out about. I just want to make sure no one else deals with this and has better experiences. 

My final words are gonna be some lessons learned about this process:

* **DO NOT LET ANYONE HAVE YOUR NOTE 7 wait until you have the new one confirmed being shipped to you or are being handed it in the store.**

* **Do not go into the store they can NOT help you and dont become upset with them for this as they simply lack the system to do so.**

* **Lastly document everything. Who you speak with. Where you go. Whats happening even. Its the best way to cover yourself as this process is being developed.**

I now am just waiting for my Iphone and hoping that it all works out and I dont end up getting charged anything after this all but I'm sure this story will only get crazier when its time to get my  replacement. We shall see. 

Thanks for your time.

**TLDR: Read the last bold area and don't try to go exchange in store!
**

*Also I'm not reading this twice so expect grammatical errors, understand I'm pretty over dealing with this anymore. :)*",T0DDTHEGOD,1473882635.0,2016-09-15 03:50:35,24,11,https://www.reddit.com/r/samsung/comments/52scvp/note_7_tmobile_experience_and_exchange_rant/,samsung,Galaxy Note 7
4vsxao,Samsung Galaxy Note 7 Hands-On,,ilovesojulee,1470150789.0,2016-08-02 23:13:09,32,9,https://www.youtube.com/watch?v=jNpQHMTs_IU,samsung,Galaxy Note 7
5020lc,S Note on the Note 7,"I just bought the Note 7. Was super excited but now I'm deflated with S Note app not being on here and I'm curious as to why it isn't? It's pretty much the main app I use and now it's not here at all. They have Samsung Notes, which is nothing like S Note. I use it primarily for making and editing pics. I tried to download S Note from the Play store and it says my phone isn't compatible. Pretty annoyed right now :/ Any help or advice would be sweet. Thank you.",ultramexicanman,1472426471.0,2016-08-29 07:21:11,6,12,https://www.reddit.com/r/samsung/comments/5020lc/s_note_on_the_note_7/,samsung,Galaxy Note 7
