id,title,selftext,author,created_utc,created_date,score,num_comments,url,subreddit,search_query
56yucj,"Galaxy S7/S7 Edge production up, likely to cover for Note 7 mess",,anonymous1507,1476202904.0,2016-10-12 00:21:44,10,11,http://eoto.tech/galaxy-s7s7-edge-production-likely-cover-note-7-mess/,samsung,Galaxy Note 7
509ry1,Galaxy Note 7 review: Samsung nearly achieves smartphone perfection,,JohnnyDoran,1472539252.0,2016-08-30 14:40:52,28,9,http://www.zdnet.com/product/samsung-galaxy-note-7/,samsung,Galaxy Note 7
56xe1j,Samsung permanently ends all Galaxy Note7 manufacturing,,theargamanknight,1476182289.0,2016-10-11 18:38:09,103,151,http://www.geektime.com/2016/10/11/samsung-ends-galaxy-note7-manufacturing-as-second-recall-looms/,samsung,Note7
5axli1,"86% of smartphone users would still buy a Samsung phone, despite Note7 disaster.",,RenegadeUK,1478189393.0,2016-11-04 00:09:53,292,45,http://www.techrepublic.com/article/86-of-smartphone-users-would-still-buy-a-samsung-phone-despite-note7-disaster/?,samsung,Note7
57bc4n,Reports claim most Note7 customers are opting for an S7 edge replacement.,,RenegadeUK,1476378107.0,2016-10-14 01:01:47,74,64,http://www.gsmarena.com/reports_claim_most_note7_customers_are_opting_for_an_s7_edge_replacement-news-21051.php,samsung,Note7
56mnhb,[Hot Topic] Samsung Note7 alternatives?,"Here are the alternatives (in alphabetical order) I can think of that haven't as much friction as the Note 7:

* [Apple iPhone 7 Plus](http://www.apple.com/ca/shop/buy-iphone/iphone-7)
* [Asus Zenfone 3 Deluxe](https://www.asus.com/Phone/ZenFone-3-Deluxe-ZS570KL/)
* [Google Pixel XL](https://store.google.com/config/pixel_phone)
* [HTC 10](http://www.htc.com/us/smartphones/htc-10/)
* [LG V20](http://www.lg.com/us/mobile-phones/v20)
* [Motorola Moto Z](http://www.motorola.ca/products/moto-z)
* [OnePlus 3](https://oneplus.net/ca_en/3)
* [Samsung Galaxy S7 Edge](http://www.samsung.com/ca/consumer/mobile-devices/smartphones/galaxy-s/galaxy-s7/)
* [Xiaomi Mi 5s Plus](http://www.mi.com/mi5splus/)
* [Sony Xperia C4](http://www.sonymobile.com/global-en/products/phones/xperia-c4/specifications/) or [Sony Xperia XZ](http://www.sonymobile.com/us/products/phones/xperia-xz)
* [ZTE Axon 7](http://www.ztedevices.ca/axon-cat/axon7.html)

I know all the companies have their own issues, but which one would you go with? If I'm missing any, let me know!",phosen,1476027039.0,2016-10-09 23:30:39,25,75,https://www.reddit.com/r/samsung/comments/56mnhb/hot_topic_samsung_note7_alternatives/,samsung,Note7
56uqut,Samsung officially asking partners to stop sales of Note7,,InsleepTech,1476137715.0,2016-10-11 06:15:15,73,45,https://news.samsung.com/global/samsung-will-ask-all-global-partners-to-stop-sales-and-exchanges-of-galaxy-note7-while-further-investigation-takes-place,samsung,Note7
5her9x,Samsung to SHUTDOWN all Note7 with update,,kdcurry,1481301687.0,2016-12-10 00:41:27,56,26,http://www.theverge.com/circuitbreaker/2016/12/9/13897794/samsung-galaxy-note-7-update-shut-down-inoperable,samsung,Note7
55oobp,"Samsung launches the Galaxy Note7 worldwide, again.",,RenegadeUK,1475514321.0,2016-10-04 01:05:21,71,24,http://www.gsmarena.com/samsung_launches_the_galaxy_note7_worldwide_again-news-20842.php,samsung,Note7
5jd0fx,"Cancelled Samsung Galaxy Note7 still has more users than LG V20, HTC Bolt and OnePlus 3T.",,RenegadeUK,1482236930.0,2016-12-20 20:28:50,94,20,http://www.gsmarena.com/samsung_galaxy_note7_still_has_more_users_than_lg_v20_htc_bolt_and_oneplus_3t-news-22262.php,samsung,Note7
58ab98,Samsung faces lawsuit from Note7 owners who couldn't use their phones,,Diazepam,1476884422.0,2016-10-19 21:40:22,41,15,http://www.computerworld.com/article/3132831/smartphones/samsung-faces-lawsuit-from-note7-owners-who-couldn-t-use-their-phones.html,samsung,Note7
571kfh,"[Discussion] Note7: for the love of gawd, Samsung don't throw the baby out with the bathwater.","The Note platform is an absolute productivity monster. I held on to my Note 2 (which I am back on now, I cannot believe it!) for 4 years because it has helped me do so much. The Note7 was an incredible piece of tech, but the spontaneous combustions wasn't so hot.^ha ^ha ^ha.

Please, please, please keep making stylus phones. Just make them explode less -- or not at all.",In_Parentheses,1476234708.0,2016-10-12 09:11:48,12,15,https://www.reddit.com/r/samsung/comments/571kfh/discussion_note7_for_the_love_of_gawd_samsung/,samsung,Note7
55a3ix,Just got my new Note7,"I've just got my new Note7. Spen feels better it's more solid and my device is overheating. 🙁

CZ",Zedgar_,1475269797.0,2016-10-01 05:09:57,3,14,https://www.reddit.com/r/samsung/comments/55a3ix/just_got_my_new_note7/,samsung,Note7
50yh9m,US - Samsung details Note7 exchange program [News],,xander42,1472903097.0,2016-09-03 19:44:57,3,14,http://www.gsmarena.com/samsung_announces_galaxy_note7_exchange_program_in_us-news-20322.php,samsung,Note7
4zhnqf,The Best Tempered Glass Screen Protector Available for Quality of Screen and Durability for Note7,,Kalinskym,1472117219.0,2016-08-25 17:26:59,3,11,https://www.reddit.com/r/samsung/comments/4zhnqf/the_best_tempered_glass_screen_protector/,samsung,Note7
5d9sof,For those of you who have recalled nd replaced your Note7 phone...,"Did someone arrive at your residence to replace it or did you get your replacement through the mail? 

I don't have any Samsung stores nearby so I called and said they would ship the replacement. A week later I was called and told by a person that they were going to come in person and deliver it. She had all my information so I'm guessing it isn't a scam but I'm still worried..

Thank you in advance.

Edit: The woman who came was with Verizon, Samsung made them replace my phone instead of my carrier because I bought mine internationally. I guess I'm a special case where there had to be a middleman there to hand over the phone. She was partnered with Stericycle and was legit. She did look sketchy at first but she had paperwork and everything. It seemed very legit to me, but if im billed 800$ in the next month something is wrong. The phone works fine and has everything on it like you'd get in a new one. so idk ¯\\\_(ツ)_/¯",Shazamo_,1479310557.0,2016-11-16 23:35:57,3,9,https://www.reddit.com/r/samsung/comments/5d9sof/for_those_of_you_who_have_recalled_nd_replaced/,samsung,Note7
4xt995,So excited about the new Note7 in here..,,LaurentyuS,1471263200.0,2016-08-15 20:13:20,23,7,https://i.redd.it/ybsy6hlcfjfx.jpg,samsung,Note7
4vwjad,Discussion: Are the curves on note7 steeper than s7Edge?,"Hi all,

As the title asks...

Which model, between Note7 and S7Edge, has 'steeper' curves?

I've watched a few hands-on videos of the Note7 and I am getting differing information!

Thanks!",Charrzooka,1470194988.0,2016-08-03 11:29:48,7,8,https://www.reddit.com/r/samsung/comments/4vwjad/discussion_are_the_curves_on_note7_steeper_than/,samsung,Note7
53ay2b,Any word on when the Note7 will return?,"I have been wanted to get the Note7 but then the recall happen, just wanted to know if they were going to come back any time soon ",HalfandHoff,1474176288.0,2016-09-18 13:24:48,2,7,https://www.reddit.com/r/samsung/comments/53ay2b/any_word_on_when_the_note7_will_return/,samsung,Note7
4ys56v,Good tempered glass for Note7?,"Looking for any glass that covers a majority of the screen, doesn't have to cover the edges as long as it doesn't fall off, had one of those on a s6 edge and didn't stick at all",replaytheparadox,1471739289.0,2016-08-21 08:28:09,3,7,https://www.reddit.com/r/samsung/comments/4ys56v/good_tempered_glass_for_note7/,samsung,Note7
5719kz,My experience with the Galaxy Note7,,myartdw,1476230707.0,2016-10-12 08:05:07,5,6,https://megapowertech.blogspot.com/2016/10/galaxy-note7-recall-experience.html,samsung,Note7
4y7wb9,Question about Note7 Pre-order deals,"Anyone know how long these Samsung phone deals usually last? Like the preorder and get a free Gear Fit2 watch or free MicroSD deals going on now. Or do new deals usually pop up? Are they usually better/worse than the preorder deals?

Reason I'm asking is because I'm very interested in switching from my 6Plus to the Note7 but I'd like to see what Apple shows off next month first. The current preorder deals are really good though.

Also, the last time I had an Android phone was 2013 (the original HTC One). Have they gotten ""smoother"" to use since? With the HTC One, the whole Android OS felt a bit laggy at times and not really as intuitive as an iPhone. Are Samsung phones different? This is the first time I've really considered switching from an iPhone (the HTC One I was sort of forced into and only had it for a few months) and I just wanna make sure I'm well researchedd before taking the dive. Thanks!",RayFoxII,1471465206.0,2016-08-18 04:20:06,5,6,https://www.reddit.com/r/samsung/comments/4y7wb9/question_about_note7_preorder_deals/,samsung,Note7
55gl9a,"[HELP] Ordered my Note7 on Aug 3, still have phone in a box waiting on Samsung to issue me return...anything?","I ordered my phone directly from Samsung.com, assuming that I would receive the device sooner that way, and avoiding signing a contract. Took almost a month, and I received my device the same day they issued their recall.

Since that point, I have called them a dozen or so times, attempted to do live chat, and attempted email. On the phone, I get transferred at least once, but as many as 5 times, before either being told that I will be contacted at a later date, or there is nothing they can do until the new information comes out (always 'tomorrow'), or I get hung up on.

Live chat defaults to 'We are technical support only' after 20 minutes of typing back and forth.

Email has yet to return any response.

I HAVE received default emails, ie notifications and, most recently, a form to fill out for my a) return and refund; b) return and replace with S device; c) return and replace with a new Note7. The order number in this email was different from the order number on both my shipping label as well as online in my Samsung account. Using the correct order number (the one they provided didn't work), I opted for 'c', was taken to a landing page explaining that I would be receiving my return packaging and information on my replacement within 2-3 days, and received another email with a confirmation number.  This took place on September 22.

Since then, I have called in several times after waiting 5 days, only to begin repeating the process or being hung up on, transferred, or being told that my concerns are important and they will make a note for me (without gathering any information or looking my account up). My online account shows no new orders, or any information about the replacement.

I'm hoping someone here can give me some guidance or phone numbers or anything. After spending nearly $1000 on this phone, it's aggravating to look at it still packaged in it's box.",sladigar,1475377672.0,2016-10-02 11:07:52,4,4,https://www.reddit.com/r/samsung/comments/55gl9a/help_ordered_my_note7_on_aug_3_still_have_phone/,samsung,Note7
4z1idw,[Other] Note7: What apps are pre-loaded?,"Seems they vary based on the carrier. What carrier do you have and what apps were pre-loaded (aka bloatware)? 
",Scasa,1471885106.0,2016-08-23 00:58:26,2,4,https://www.reddit.com/r/samsung/comments/4z1idw/other_note7_what_apps_are_preloaded/,samsung,Note7
4z8w4w,S Pen already stuck in my Galaxy Note7?,It's not retracting when I push it in.. so it won't come out.,Darig0n,1471987781.0,2016-08-24 05:29:41,5,3,https://www.reddit.com/r/samsung/comments/4z8w4w/s_pen_already_stuck_in_my_galaxy_note7/,samsung,Note7
4yejlb,Note7 and Gear VR...must buy new version?,"Can we use the first generation Gear VR with an adapter with the Note7, or do we have to buy their new version? Was really surprised that the new Gear VR wasn't one of the promo options...",wildonrio,1471551750.0,2016-08-19 04:22:30,2,3,https://www.reddit.com/r/samsung/comments/4yejlb/note7_and_gear_vrmust_buy_new_version/,samsung,Note7
4vwsxt,Does Note7 Or s7Edge have more of a curve screen?,"Hi all,

As the title asks... Does the Note 7 or S7Edge have more 'curve' to its screen?

Thanks!",Charrzooka,1470199417.0,2016-08-03 12:43:37,2,2,https://www.reddit.com/r/samsung/comments/4vwsxt/does_note7_or_s7edge_have_more_of_a_curve_screen/,samsung,Note7
50snnw,"Samsung Will Replace, Refund Or Repair All Galaxy Note7s In Australia",,Aced21,1472813860.0,2016-09-02 18:57:40,7,1,http://www.gizmodo.com.au/2016/09/samsung-will-replace-refund-or-repair-all-galaxy-note7s-in-australia/,samsung,Note7
50tlbc,Samsung.com Note7 preorder 20 days ago. How much longer now?,"So I preordered a Note7 Verizon on Samsung.com about 20 days ago. Still ""preparing for shipment"".

Now with the recall going on how long can I expect to wait to get my $1000 pre-ordered phone?",GoodFoBidness,1472827800.0,2016-09-02 22:50:00,6,2,https://www.reddit.com/r/samsung/comments/50tlbc/samsungcom_note7_preorder_20_days_ago_how_much/,samsung,Note7
50uciy,PSA: Recall Process for USCellular Note7,"I just got off the phone with US Cellular regarding their handling of the recall for the Note7.  Below is what they said they are doing:    
 
* Customers with a Note7 is to bring the phone in to a USCC Authorized store for a full refund on all deposits and, if financed, all payments made towards the phone.    
* USCC is also allowing customers to choose a replacement phone of ANY value (in their stock of course) at no charge.        
* If you financed your phone, you will have to obviously make the monthly payment on the new phone but they are not charging the activation fee.    
* Finally, if any accessories were purchased at a USCC store, they are also issuing refunds on those items as well.    

At the time of speaking with the rep, there is no mention from Samsung as to how they will handle replacing the phone or if a new Note7 will be issued.  As far as we know from the interviews with Samsung reps right now, they will not be announcing this info until next week.  Hope this helps you guys and gals.",Tibiryus,1472836794.0,2016-09-03 01:19:54,2,2,https://www.reddit.com/r/samsung/comments/50uciy/psa_recall_process_for_uscellular_note7/,samsung,Note7
4zurzq,"Beyond the Specs: In the End, the Note7 is a Remarkable Phone for Life",,altimax98,1472313014.0,2016-08-27 23:50:14,21,0,http://www.xda-developers.com/note7-remarkable-phone-for-life/,samsung,Note7
529p8o,How the Samsung Note7 recall is handled in France. (XPost from /r/GalaxyNote7) aka Possibly all Note 7s in the world to be deactivated by September 30?,"Credit goes to /u/LimboJr https://www.reddit.com/r/GalaxyNote7/comments/523zui/how_the_samsung_note7_recall_is_handled_in_france/

Every Note7 owner (no matter where you got it, could it be from Samsung itself or your carrier) is at the present time being called by the company to receive a new one by mail starting from Sept. 19th.
The package will include a BNIB phone of your current color, a Gear VR (which was already promised for us pre-orderers) and a prepaid parcel to send the defective device back without charges.
We were also told that every recalled phone will be REMOTELY DEACTIVATED after Sept. 30th. It means that we practically have no other choice than following the procedure.
Some of us requested a commercial gesture for the inconvenience, which will be looked at.",DnB925Art,1473616214.0,2016-09-12 01:50:14,2,1,https://www.reddit.com/r/samsung/comments/529p8o/how_the_samsung_note7_recall_is_handled_in_france/,samsung,Note7
4zw2i5,Using OK Google bypasses lock screen on new Note7,Any ideas how that's possible? ,thecampo,1472329871.0,2016-08-28 04:31:11,2,1,https://www.reddit.com/r/samsung/comments/4zw2i5/using_ok_google_bypasses_lock_screen_on_new_note7/,samsung,Note7
588yiz,Samsung faces proposed U.S. class action lawsuit over Note7,,Timlskamp,1476859755.0,2016-10-19 14:49:15,6,0,https://article.wn.com/view/2016/10/19/Samsung_faces_proposed_US_class_action_lawsuit_over_Note7/,samsung,Note7
526aa3,Samsung Galaxy Note7 Users Urged to Turn Off Phones,,wiseprogressivethink,1473557315.0,2016-09-11 09:28:35,6,0,http://abcnews.go.com/Technology/samsung-galaxy-note7-users-urged-turn-off-phones/story?id=41983208,samsung,Note7
4yjnzt,[Discussion] Note7 dual Sim card question: Can I use this phone as my work and personal phone?,"So I currently have a crappy HTC I use as a personal phone and work is having me get a phone. (Sprint)  

My note 7 is on the way with the new work number but it'll be a phone I own. Naturally I want to use this phone for a lot of personal reasons, as well as work stuff. 

Going into this I was going to have both phones on me, with work calls going to the HTC, (so I can have the ability to shut it off when I'm off work)  and all work emails, reports and personal stuff on the Note 7.

Then I noticed the Note supports two Sim cards. Coulf I just run both cards in the Note 7 and take calls to both numbers on one phone? Anyone do something like this before? What did it look like?

Thanks in advance! ",Tekki,1471621841.0,2016-08-19 23:50:41,2,0,https://www.reddit.com/r/samsung/comments/4yjnzt/discussion_note7_dual_sim_card_question_can_i_use/,samsung,Note7
4z758h,How many of you have shattered your screens already?,"Note7 -Had the phone for literally 2 days and dropped it with a case and it shattered? so much for more shatter resistant screen. 

Anyone has any any recommendations for temered glass screen protectors


EDIT: Forgot for put Note7 in Title.",z0ishi288,1471967484.0,2016-08-23 23:51:24,21,59,https://www.reddit.com/r/samsung/comments/4z758h/how_many_of_you_have_shattered_your_screens/,samsung,Note7
50uvpt,Note 7 owners,I have had the note7 for a week. No problems. Now with this recall are you gonna replace yours? My phone battery has been fine. Last 7am-11pm and I use my phone alot. I usually let it completely die every couple charges. It got hot once but hasnt since. Wondering if its worth the hassle to get a new one. Setting it up can be a bitch.,ANADucks88,1472842873.0,2016-09-03 03:01:13,5,31,https://www.reddit.com/r/samsung/comments/50uvpt/note_7_owners/,samsung,Note7
58pqb9,Samsung confirms the Blue Coral Galaxy S7 Edge is coming.,,RenegadeUK,1477085022.0,2016-10-22 05:23:42,26,23,http://www.androidauthority.com/blue-coral-samsung-galaxy-s7-edge-confirmed-723770/,samsung,Note7
574ooo,Note 7 users,"I'm sure like everyone else, you love the Note 7. What phone are you getting to replace it and why? I've been looking around for the past 2 days and don't really like anything else on the market or even the v20 for not being waterproof and no SD card. I'm even considering iPhone 7 plus now. This whole changing out phones has been a giant waste of my time, spent 9 hours over the course of 2 days at AT&T store for Chaning out devices TWICE already. So frustrated",Usefulidiot84,1476286500.0,2016-10-12 23:35:00,3,24,https://www.reddit.com/r/samsung/comments/574ooo/note_7_users/,samsung,Note7
56kwl1,Samsung knew a third replacement Note 7 caught fire on Tuesday and said nothing,,dunkin1980,1475989992.0,2016-10-09 13:13:12,68,53,http://www.theverge.com/2016/10/9/13215728/samsung-galaxy-note-7-third-fire-smoke-inhalation,samsung,Samsung fire
56suff,Samsung halts Note 7 production after new fire scare: source,,dunkin1980,1476116980.0,2016-10-11 00:29:40,18,1,https://www.yahoo.com/finance/news/u-carriers-halt-samsung-note-005313284.html,samsung,Samsung fire
51i0v9,I know someone who's note 7 exploded,,brodesto,1473202532.0,2016-09-07 06:55:32,111,39,http://imgur.com/LupcPI5,samsung,Note 7 recall
52ye7w,"Samsung and CPSC have officially recalled the Note 7. You can now check IMEI numbers to see if your phone is subject to the recall. Carriers reporting no exact date for new Note 7s set, but Samsung claiming no later than 9/21.",,Instincts,1473973396.0,2016-09-16 05:03:16,71,39,http://www.samsung.com/us/note7recall/,samsung,Note 7 recall
54p6qr,[Other] I want my potentially explosive Note 7 back,"Hey all, basically a short vent here.

I got my replacement device on Friday and honestly have had nothing but issues with the thing. It's incredibly slow, gets easily bogged down by tasks my Note 5 and previous Note 7 handled with ease, games actually stutter (these same games worked flawlessly on my Note 5), both the iris and fingerprint scanners are somehow slower, the battery life isn't as good as my old Note 7, my apps in the secure folder no longer work (but they do outside of it) and the thing gets HOT. I mean, very hot! My original Note 7 was always cool to the touch and I was never worried about it over heating but with this one I'm actually scared it will blow up. 

I'm incredibly disappointed by this replacement device and wish I had just kept my old one. Restoring the device hasn't helped me and I'm not really sure what else I could do. I work for a phone dealer and the thought of sending it to Samsung has crossed my mind but I don't know if it's really a problem that they could fix.

Has anybody else experienced issues with their replacement devices or did I just get a lemon? ",swellblitz,1474954954.0,2016-09-27 13:42:34,11,37,https://www.reddit.com/r/samsung/comments/54p6qr/other_i_want_my_potentially_explosive_note_7_back/,samsung,Note 7 recall
53pacg,My Note 7 Replacement Experience (Canada),"UPDATE 21/09/2016:

Spent another hour on the phone with Samsung, got transferred three times. Again, they said that they will escalate this problem to their manager. 



Hello everyone,

I would like to share my experience with getting a replacement Note 7 unit.

I pre-ordered my Note 7 with Bell Canada and got the phone around September 1st. After receiving the notice for the recall, I submitted the replacement form on September 7th.

The replacement website stated that I ""will be contacted by a Samsung representative within 48 hours."" I heard nothing from them. I also didn't get any email confirmation after I submitted the replacement form.

I also contacted Samsung about the screen protectors and DBrand skins that I had already applied on the current phone(probably about $40CDN total) and asked for some kind of compensation for the amount I spent. After bouncing me around different departments, I ended up at Complaints (I am not sure why) and all I got was a monotonic ""I understand your concern, but Samsung is not going to pay for your accessories.""

Fast forward a few days later, I suddenly received an email from FedEx telling me that I have a package coming, from sender ""STERICYCLE RMS/CANADA"". I have no idea what this company is until I googled online and some users pointed out that it is the Note 7 replacement unit. Again, I was told that they will contact me to confirm the color of the phone and the address.

However, the delivery address is the one that I used to register with my phone carrier. It hasn't been updated for years. This address is certainly not the one I registered the replacement form with. I have no clue how they got this information.

Since Friday, which is the day I received the FedEx notice, I have been contacting Samsung and FedEx trying change the delivery address. With FedEx, they told me that the value on the package is too high for the receiver to change the address.

At Samsung, no one knows how to change the address and no one seemed willing to help out either. The department that handles the Note 7 Replacement says that they only help people with replacement registration and not responsible for anything afterwards. The main customer service line refers me back to the Replacement number.

I have probably wasted 10+ hrs on the phone with them. It was not just the fact that they had no clue what was going on; Samsung customer service's tone and attitude pretty much gave me cancer.

Right now the package is ""Out for Delivery"" at a city no where near where I live and I have no idea what to do.

I am so disappointment with Samsung as a company and how they handle problems like this. It really shows how bad the internal communication is.

I am going to try to get a refund for the Note 7 and change it to either an iPhone or wait until the new Nexus(or Pixel) phones come out. I am done with Samsung for the time being.

Thanks for reading, and I hope the rest of you guys receive your Note 7 replacement without too much trouble. And have a good day! :)
",MrHarBear,1474401525.0,2016-09-21 03:58:45,12,29,https://www.reddit.com/r/samsung/comments/53pacg/my_note_7_replacement_experience_canada/,samsung,Note 7 recall
53ic1k,Note 7: Samsung can no longer take returns (If ordered through Samsung.com),"(I ordered my Note 7 Directly from Samsung.com)

I was on vacation when the whole recall thing started. I finally got home and found out FedEx, UPS, USPS are no longer taking the Note 7 back to Samsung because of the possibility of them exploding (As of 9/16/16). I called Samsung's eCommerce dept and they gave me a new number to call. I called them and they told me to stop using the device and sit on my hands until they figure something out. WTF samsung. Anyone else having issues exchanging their notes through Samsung? (Not talking the people who got their Notes from brick-n-morter stores.)

EDIT from 10/1/16: Still waiting for Samsung to figure out what the hell to do.  I not decided to just return it, tired of this shit customer service.",RainStorm13,1474301744.0,2016-09-20 00:15:44,28,26,https://www.reddit.com/r/samsung/comments/53ic1k/note_7_samsung_can_no_longer_take_returns_if/,samsung,Note 7 recall
50wf7x,For anyone who bought a Note 7 from non-retailers.,"We're pretty much stuck with a ticking time bomb :( and 800 bucks down. 

http://imgur.com/a/UEhNW",SweetThuy,1472862756.0,2016-09-03 08:32:36,4,20,https://www.reddit.com/r/samsung/comments/50wf7x/for_anyone_who_bought_a_note_7_from_nonretailers/,samsung,Note 7 recall
